{
  "schemaVersion": "protocol-lab-run-plan-v1",
  "runPlanId": "http1-conformance-smoke-reference",
  "runPlanVersion": "2026.06.12",
  "displayName": "HTTP/1 conformance smoke reference run",
  "packages": [
    {
      "packageId": "protocol-lab-http1-core-scenarios",
      "packageVersion": "0.0.0-fixture",
      "sha256": "0123456789abcdef0123456789abcdef0123456789abcdef0123456789abcdef"
    },
    {
      "packageId": "protocol-lab-reference-http1-test-executor",
      "packageVersion": "0.1.2-fixture",
      "sha256": "abcdef0123456789abcdef0123456789abcdef0123456789abcdef0123456789"
    },
    {
      "packageId": "kestrel-http1",
      "packageVersion": "0.0.0-fixture",
      "sha256": "1111111111111111111111111111111111111111111111111111111111111111"
    }
  ],
  "suiteIds": [
    "conformance-smoke"
  ],
  "scenarioIds": [
    "http.core.plaintext",
    "http.core.json",
    "http.payload.bytes.1kb"
  ],
  "implementationIds": [
    "kestrel-http1"
  ],
  "testExecutorIds": [
    "protocol-lab-reference-http1-test-executor"
  ],
  "protocols": [
    "h1"
  ],
  "loadProfileId": "smoke",
  "targetMode": "implementation-resolved",
  "targetNetworkMode": "published-endpoint",
  "requiredCapabilities": [
    {
      "name": "protocol-lab.public-contracts",
      "value": "true"
    }
  ],
  "comparisonGroups": [
    {
      "groupId": "http1-conformance",
      "scenarioIds": [
        "http.core.plaintext",
        "http.core.json",
        "http.payload.bytes.1kb"
      ],
      "sameExecutorRequired": true,
      "sameLoadProfileRequired": true
    }
  ],
  "publicationIntent": "non-public",
  "labels": [
    "result-kind:conformance",
    "suite-purpose:conformance"
  ],
  "notes": "Conformance fixture proving behavior-validity selection. A slow valid run is not a conformance failure."
}
